{
  "gate_version": "1.0",
  "source_contract_id": "rsc.monopoly.phase11_task14_baseline_template_validation.20260417",
  "items": [
    {
      "item_id": "cg-max-game-length",
      "topic": "最大游戏时长/僵局处理",
      "decision": "clarification_required",
      "risk_level": "high",
      "impact": "若无人破产，单局可能无限持续，直接影响胜负收敛与可玩闭环验收。",
      "provisional_default": "200 回合上限；若到达上限，则按资金最高者获胜。",
      "provisional": true,
      "inference_basis": "GDD 只给出 20-40 分钟目标时长，未定义硬性僵局收敛机制。",
      "reason": "GDD gives target match length but does not define a hard stalemate or round limit.",
      "confidence": 0.55
    },
    {
      "item_id": "cg-platform-persistence",
      "topic": "设置持久化策略",
      "decision": "accept_with_safe_default",
      "risk_level": "medium",
      "impact": "影响设置页 Apply/Back 的保存语义，以及平台基础能力的最小实现边界。",
      "default_value": "session_only",
      "provisional": false,
      "provisional_warning": true,
      "inference_basis": "Phase 1 先保证设置页可用；未锁定持久化时采用 session_only 更保守。",
      "reason": "Settings persistence is not locked by GDD and affects platform behavior.",
      "confidence": 0.82
    },
    {
      "item_id": "cg-card-events-phase1",
      "topic": "Chance / Community 在 Phase 1 的行为",
      "decision": "accept_as_explicit",
      "risk_level": "low",
      "impact": "决定卡牌格是否进入当前阶段实现范围。",
      "default_value": "踩上去无事发生，不触发卡牌事件。",
      "inference_basis": "GDD 2.2、2.3 明确写明 Phase 1 留空，不触发事件。",
      "reason": "这是 GDD 已明确锁定的显式规则，不需要追问。",
      "confidence": 0.98
    },
    {
      "item_id": "cg-hud-layout-style",
      "topic": "HUD 布局方式",
      "decision": "send_to_design_space_discovery",
      "risk_level": "low",
      "impact": "影响 HUD 与棋盘的可读性，但不改变规则语义。",
      "reason": "GDD 只锁定 HUD 必须显示的信息，未锁定布局；属于 realization-level 设计空间。",
      "confidence": 0.91
    },
    {
      "item_id": "cg-player-token-visual-style",
      "topic": "玩家棋子视觉样式",
      "decision": "accept_with_safe_default",
      "risk_level": "low",
      "impact": "影响可辨识度与原型观感，但不改变棋盘规则。",
      "default_value": "简洁彩色几何棋子（圆柱体或锥体）",
      "inference_basis": "GDD Part B 已建议 Phase 1 使用简单几何体作为棋子模型。",
      "reason": "在玩法验证阶段，优先保证可区分与实现成本可控。",
      "confidence": 0.9
    },
    {
      "item_id": "cg-dice-roll-feedback",
      "topic": "骰子表现与反馈节奏",
      "decision": "send_to_design_space_discovery",
      "risk_level": "low",
      "impact": "影响回合节奏与反馈品质，但不改变 2D6 的规则约束。",
      "reason": "GDD 锁定了 2D6 规则，没有锁定表现方式，适合放入设计空间探索。",
      "confidence": 0.88
    },
    {
      "item_id": "cg-platform-foundation-boundary",
      "topic": "平台基础能力边界",
      "decision": "clarification_required",
      "risk_level": "high",
      "impact": "影响窗口模式、分辨率、退出处理与设置保存的最终交付边界。",
      "provisional_default": "桌面端本地运行；支持窗口模式、分辨率切换，但设置仅本次会话生效。",
      "provisional": true,
      "inference_basis": "Universal Baseline 要求平台基础能力存在，但 GDD 未明确最终平台和持久化边界。",
      "reason": "该项会影响平台配置与设置行为，应保留为 clarifications。",
      "confidence": 0.6
    }
  ],
  "provisional_items": [
    {
      "item_id": "cg-max-game-length",
      "topic": "最大游戏时长/僵局处理",
      "provisional_value": "200 回合上限；若到达上限，则按资金最高者获胜。",
      "source_decision": "clarification_required",
      "risk_level": "high",
      "downstream_impacts": [
        "design_decision_log[].provisional = true",
        "build_steps[].execution_hints.contains_provisional = true",
        "reviewed_handoff_v3.provisional_items[] includes item"
      ]
    },
    {
      "item_id": "cg-platform-foundation-boundary",
      "topic": "平台基础能力边界",
      "provisional_value": "桌面端本地运行；支持窗口模式、分辨率切换，但设置仅本次会话生效。",
      "source_decision": "clarification_required",
      "risk_level": "high",
      "downstream_impacts": [
        "design_decision_log[].provisional = true",
        "build_steps[].execution_hints.contains_provisional = true",
        "reviewed_handoff_v3.provisional_items[] includes item"
      ]
    }
  ],
  "blocking_items": [],
  "fast_mode": true,
  "clarification_gate_policy": "auto_default_low_medium_only",
  "retained_clarifications": [
    "cg-max-game-length",
    "cg-platform-foundation-boundary"
  ],
  "items_by_decision_summary": {
    "accept_as_explicit": 1,
    "accept_with_safe_default": 2,
    "send_to_design_space_discovery": 2,
    "clarification_required": 2
  },
  "downstream_propagation_contract": {
    "skill_fragment_provisional_flag": "design_decision_log[].provisional = true",
    "build_ir_provisional_flag": "build_steps[].execution_hints.contains_provisional = true",
    "handoff_provisional_summary": "reviewed_handoff_v3.provisional_items[]"
  },
  "metadata": {
    "generated_at": "2026-04-17T05:14:44.892026+00:00",
    "generator": "AgentBridge.Compiler.ClarificationGate.v1",
    "source_run_id": "run-20260417-051444-a2b8",
    "blocked_by_critical": false
  }
}